{
  "$schema": "https://json-schema.org/draft/2020-12/schema",
  "$id": "eval-cases",
  "title": "Eval cases",
  "description": "Reference schema for evals/cases.json. scripts/validate-skills.mjs is the enforced source of truth.",
  "type": "array",
  "minItems": 3,
  "items": {
    "type": "object",
    "required": ["id", "prompt", "expect"],
    "properties": {
      "id": { "type": "string", "pattern": "^[a-z0-9]+(-[a-z0-9]+)*$" },
      "prompt": { "type": "string", "minLength": 10 },
      "expect": { "type": "array", "minItems": 1, "items": { "type": "string" } },
      "forbid": { "type": "array", "items": { "type": "string" } }
    },
    "additionalProperties": false
  }
}
